{"schema_version":1,"task_id":"7f1c2a9e-3b4d-4e5f-8a6b-1c2d3e4f5a6b","summary":"Add MetricCard using the existing Card primitive.","operations":[{"path":"src/dashboard/components/MetricCard.tsx","action":"create","symbol":"MetricCard","rationale":"Required by the ticket."}],"assumptions":[],"verification_plan":["pnpm typecheck","pnpm test MetricCard"],"needs_more_context":false,"requires_human_approval":false}
